"Key[String]","en[String]","ar[String]","bg[String]","cs[String]","da[String]","de[String]","es[String]","es_419[String]","fi[String]","fr[String]","hu[String]","it[String]","ja[String]","ko[String]","nl[String]","nb[String]","pl[String]","pt[String]","pt_BR[String]","ro[String]","ru[String]","sv[String]","th[String]","tr[String]","uk[String]","vi[String]","zh_CN[String]","zh_TW[String]"
"unknown","Unknown","Unknown","Unknown","Unknown","Unknown","Unknown","Unknown","Unknown","Unknown","Unknown","Unknown","Unknown","Unknown","Unknown","Unknown","Unknown","Unknown","Unknown","Unknown","Unknown","Unknown","Unknown","Unknown","Unknown","Unknown","Unknown","Unknown","Unknown"
"copper_vein","A copper vein that can be mined with a pickaxe.","A copper vein that can be mined with a pickaxe.","A copper vein that can be mined with a pickaxe.","A copper vein that can be mined with a pickaxe.","A copper vein that can be mined with a pickaxe.","A copper vein that can be mined with a pickaxe.","A copper vein that can be mined with a pickaxe.","A copper vein that can be mined with a pickaxe.","A copper vein that can be mined with a pickaxe.","A copper vein that can be mined with a pickaxe.","A copper vein that can be mined with a pickaxe.","A copper vein that can be mined with a pickaxe.","A copper vein that can be mined with a pickaxe.","A copper vein that can be mined with a pickaxe.","A copper vein that can be mined with a pickaxe.","A copper vein that can be mined with a pickaxe.","A copper vein that can be mined with a pickaxe.","A copper vein that can be mined with a pickaxe.","A copper vein that can be mined with a pickaxe.","A copper vein that can be mined with a pickaxe.","A copper vein that can be mined with a pickaxe.","A copper vein that can be mined with a pickaxe.","A copper vein that can be mined with a pickaxe.","A copper vein that can be mined with a pickaxe.","A copper vein that can be mined with a pickaxe.","A copper vein that can be mined with a pickaxe.","A copper vein that can be mined with a pickaxe.","A copper vein that can be mined with a pickaxe."
"birch_tree","A birch tree that can be chopped down with an axe.","A birch tree that can be chopped down with an axe.","A birch tree that can be chopped down with an axe.","A birch tree that can be chopped down with an axe.","A birch tree that can be chopped down with an axe.","A birch tree that can be chopped down with an axe.","A birch tree that can be chopped down with an axe.","A birch tree that can be chopped down with an axe.","A birch tree that can be chopped down with an axe.","A birch tree that can be chopped down with an axe.","A birch tree that can be chopped down with an axe.","A birch tree that can be chopped down with an axe.","A birch tree that can be chopped down with an axe.","A birch tree that can be chopped down with an axe.","A birch tree that can be chopped down with an axe.","A birch tree that can be chopped down with an axe.","A birch tree that can be chopped down with an axe.","A birch tree that can be chopped down with an axe.","A birch tree that can be chopped down with an axe.","A birch tree that can be chopped down with an axe.","A birch tree that can be chopped down with an axe.","A birch tree that can be chopped down with an axe.","A birch tree that can be chopped down with an axe.","A birch tree that can be chopped down with an axe.","A birch tree that can be chopped down with an axe.","A birch tree that can be chopped down with an axe.","A birch tree that can be chopped down with an axe.","A birch tree that can be chopped down with an axe."
"shrimp_school","A school of shrimp that can be caught with a net.","A school of shrimp that can be caught with a net.","A school of shrimp that can be caught with a net.","A school of shrimp that can be caught with a net.","A school of shrimp that can be caught with a net.","A school of shrimp that can be caught with a net.","A school of shrimp that can be caught with a net.","A school of shrimp that can be caught with a net.","A school of shrimp that can be caught with a net.","A school of shrimp that can be caught with a net.","A school of shrimp that can be caught with a net.","A school of shrimp that can be caught with a net.","A school of shrimp that can be caught with a net.","A school of shrimp that can be caught with a net.","A school of shrimp that can be caught with a net.","A school of shrimp that can be caught with a net.","A school of shrimp that can be caught with a net.","A school of shrimp that can be caught with a net.","A school of shrimp that can be caught with a net.","A school of shrimp that can be caught with a net.","A school of shrimp that can be caught with a net.","A school of shrimp that can be caught with a net.","A school of shrimp that can be caught with a net.","A school of shrimp that can be caught with a net.","A school of shrimp that can be caught with a net.","A school of shrimp that can be caught with a net.","A school of shrimp that can be caught with a net.","A school of shrimp that can be caught with a net."
"eldia","A red Orcish woman. She looks friendly enough.","A red Orcish woman. She looks friendly enough.","A red Orcish woman. She looks friendly enough.","A red Orcish woman. She looks friendly enough.","A red Orcish woman. She looks friendly enough.","A red Orcish woman. She looks friendly enough.","A red Orcish woman. She looks friendly enough.","A red Orcish woman. She looks friendly enough.","A red Orcish woman. She looks friendly enough.","A red Orcish woman. She looks friendly enough.","A red Orcish woman. She looks friendly enough.","A red Orcish woman. She looks friendly enough.","A red Orcish woman. She looks friendly enough.","A red Orcish woman. She looks friendly enough.","A red Orcish woman. She looks friendly enough.","A red Orcish woman. She looks friendly enough.","A red Orcish woman. She looks friendly enough.","A red Orcish woman. She looks friendly enough.","A red Orcish woman. She looks friendly enough.","A red Orcish woman. She looks friendly enough.","A red Orcish woman. She looks friendly enough.","A red Orcish woman. She looks friendly enough.","A red Orcish woman. She looks friendly enough.","A red Orcish woman. She looks friendly enough.","A red Orcish woman. She looks friendly enough.","A red Orcish woman. She looks friendly enough.","A red Orcish woman. She looks friendly enough.","A red Orcish woman. She looks friendly enough."
"frail_skeleton","A frail skeleton.","A frail skeleton.","A frail skeleton.","A frail skeleton.","A frail skeleton.","A frail skeleton.","A frail skeleton.","A frail skeleton.","A frail skeleton.","A frail skeleton.","A frail skeleton.","A frail skeleton.","A frail skeleton.","A frail skeleton.","A frail skeleton.","A frail skeleton.","A frail skeleton.","A frail skeleton.","A frail skeleton.","A frail skeleton.","A frail skeleton.","A frail skeleton.","A frail skeleton.","A frail skeleton.","A frail skeleton.","A frail skeleton.","A frail skeleton.","A frail skeleton."
"lost_soul","A poor lost soul.","A poor lost soul.","A poor lost soul.","A poor lost soul.","A poor lost soul.","A poor lost soul.","A poor lost soul.","A poor lost soul.","A poor lost soul.","A poor lost soul.","A poor lost soul.","A poor lost soul.","A poor lost soul.","A poor lost soul.","A poor lost soul.","A poor lost soul.","A poor lost soul.","A poor lost soul.","A poor lost soul.","A poor lost soul.","A poor lost soul.","A poor lost soul.","A poor lost soul.","A poor lost soul.","A poor lost soul.","A poor lost soul.","A poor lost soul.","A poor lost soul."